{
  "schemaVersion": "1.0",
  "id": "builtin-stylized",
  "name": "Built-in stylized archetypes",
  "description": "Engine-agnostic archetype catalogue shipped with the generator. assetRef values are logical envgen:// keys; an engine integration supplies its own registry (same schema) that maps archetypes to real assets.",
  "archetypes": [
    {
      "id": "building.apartment.block_mid",
      "category": "building",
      "kinds": [
        "apartment_block"
      ],
      "tags": [
        "stylized",
        "urban",
        "concrete"
      ],
      "dimensions": {
        "widthM": 24,
        "depthM": 12,
        "heightM": 15.0
      },
      "variants": 2,
      "assetRef": "envgen://building/apartment/block_mid",
      "cover": "full",
      "constraints": {
        "minFloors": 3,
        "maxFloors": 6,
        "roofs": [
          "flat"
        ],
        "conditions": [
          "intact",
          "damaged"
        ]
      }
    },
    {
      "id": "building.barn.timber",
      "category": "building",
      "kinds": [
        "barn"
      ],
      "tags": [
        "stylized",
        "rural",
        "wood"
      ],
      "dimensions": {
        "widthM": 18,
        "depthM": 10,
        "heightM": 9.0
      },
      "variants": 2,
      "assetRef": "envgen://building/barn/timber",
      "cover": "full",
      "constraints": {
        "minFloors": 1,
        "maxFloors": 2,
        "roofs": [
          "gable"
        ],
        "conditions": [
          "intact",
          "damaged"
        ]
      }
    },
    {
      "id": "building.church.village",
      "category": "building",
      "kinds": [
        "church"
      ],
      "tags": [
        "stylized",
        "rural",
        "stone"
      ],
      "dimensions": {
        "widthM": 16,
        "depthM": 10,
        "heightM": 16.0
      },
      "variants": 1,
      "assetRef": "envgen://building/church/village",
      "cover": "full",
      "constraints": {
        "roofs": [
          "gable"
        ],
        "conditions": [
          "intact",
          "damaged"
        ]
      }
    },
    {
      "id": "building.dacha.banya",
      "category": "building",
      "kinds": [
        "banya_small",
        "bathhouse"
      ],
      "tags": [
        "stylized",
        "rural",
        "wood",
        "dacha"
      ],
      "dimensions": {
        "widthM": 3.5,
        "depthM": 3,
        "heightM": 3
      },
      "variants": 2,
      "assetRef": "envgen://building/dacha/banya",
      "cover": "full",
      "constraints": {
        "maxFloors": 1,
        "roofs": [
          "gable",
          "mono_pitch"
        ],
        "conditions": [
          "intact",
          "damaged"
        ]
      },
      "description": "Small log bathhouse (banya)."
    },
    {
      "id": "building.dacha.gazebo",
      "category": "building",
      "kinds": [
        "gazebo"
      ],
      "tags": [
        "stylized",
        "rural",
        "wood",
        "dacha"
      ],
      "dimensions": {
        "widthM": 3,
        "depthM": 3,
        "heightM": 2.8
      },
      "variants": 1,
      "assetRef": "envgen://building/dacha/gazebo",
      "cover": "partial",
      "constraints": {
        "conditions": [
          "intact",
          "damaged"
        ]
      }
    },
    {
      "id": "building.dacha.greenhouse_frame",
      "category": "building",
      "kinds": [
        "greenhouse_frame",
        "greenhouse"
      ],
      "tags": [
        "stylized",
        "rural",
        "glass",
        "dacha"
      ],
      "dimensions": {
        "widthM": 3,
        "depthM": 6,
        "heightM": 2.4
      },
      "variants": 2,
      "assetRef": "envgen://building/dacha/greenhouse_frame",
      "cover": "none",
      "description": "Arched greenhouse frame with film or polycarbonate panels.",
      "constraints": {
        "conditions": [
          "intact",
          "damaged"
        ]
      }
    },
    {
      "id": "building.dacha.outhouse",
      "category": "building",
      "kinds": [
        "outhouse"
      ],
      "tags": [
        "stylized",
        "rural",
        "wood",
        "dacha"
      ],
      "dimensions": {
        "widthM": 1.2,
        "depthM": 1.3,
        "heightM": 2.2
      },
      "variants": 2,
      "assetRef": "envgen://building/dacha/outhouse",
      "cover": "partial",
      "constraints": {
        "conditions": [
          "intact",
          "damaged"
        ]
      }
    },
    {
      "id": "building.dacha.wooden_house_medium",
      "category": "building",
      "kinds": [
        "wooden_house_medium",
        "house"
      ],
      "tags": [
        "stylized",
        "rural",
        "wood",
        "dacha"
      ],
      "dimensions": {
        "widthM": 7.5,
        "depthM": 6.5,
        "heightM": 6.5
      },
      "variants": 3,
      "assetRef": "envgen://building/dacha/wooden_house_medium",
      "cover": "full",
      "constraints": {
        "maxFloors": 1,
        "roofs": [
          "gable",
          "hip"
        ],
        "conditions": [
          "intact",
          "damaged"
        ]
      }
    },
    {
      "id": "building.dacha.wooden_house_small",
      "category": "building",
      "kinds": [
        "wooden_house_small",
        "house"
      ],
      "tags": [
        "stylized",
        "rural",
        "wood",
        "dacha"
      ],
      "dimensions": {
        "widthM": 6,
        "depthM": 5,
        "heightM": 5.5
      },
      "variants": 3,
      "assetRef": "envgen://building/dacha/wooden_house_small",
      "cover": "full",
      "constraints": {
        "maxFloors": 1,
        "roofs": [
          "gable",
          "mono_pitch"
        ],
        "conditions": [
          "intact",
          "damaged"
        ]
      }
    },
    {
      "id": "building.dacha.wooden_house_two_storey",
      "category": "building",
      "kinds": [
        "wooden_house_two_storey",
        "house"
      ],
      "tags": [
        "stylized",
        "rural",
        "wood",
        "dacha"
      ],
      "dimensions": {
        "widthM": 8,
        "depthM": 7,
        "heightM": 8.5
      },
      "variants": 2,
      "assetRef": "envgen://building/dacha/wooden_house_two_storey",
      "cover": "full",
      "constraints": {
        "minFloors": 2,
        "maxFloors": 2,
        "roofs": [
          "gable"
        ],
        "conditions": [
          "intact",
          "damaged"
        ]
      }
    },
    {
      "id": "building.factory.brick",
      "category": "building",
      "kinds": [
        "factory"
      ],
      "tags": [
        "stylized",
        "industrial",
        "brick"
      ],
      "dimensions": {
        "widthM": 40,
        "depthM": 22,
        "heightM": 14.0
      },
      "variants": 1,
      "assetRef": "envgen://building/factory/brick",
      "cover": "full",
      "constraints": {
        "minFloors": 1,
        "maxFloors": 4,
        "conditions": [
          "intact",
          "damaged"
        ]
      }
    },
    {
      "id": "building.garage.metal",
      "category": "building",
      "kinds": [
        "metal_garage",
        "garage"
      ],
      "tags": [
        "stylized",
        "rural",
        "metal",
        "dacha"
      ],
      "dimensions": {
        "widthM": 3.6,
        "depthM": 6,
        "heightM": 2.6
      },
      "variants": 2,
      "assetRef": "envgen://building/garage/metal",
      "cover": "full",
      "constraints": {
        "maxFloors": 1,
        "roofs": [
          "flat",
          "mono_pitch",
          "gable"
        ],
        "conditions": [
          "intact",
          "damaged"
        ]
      },
      "description": "Corrugated sheet-metal garage."
    },
    {
      "id": "building.garage.single",
      "category": "building",
      "kinds": [
        "garage"
      ],
      "tags": [
        "stylized",
        "brick"
      ],
      "dimensions": {
        "widthM": 6.5,
        "depthM": 4,
        "heightM": 3.0
      },
      "variants": 2,
      "assetRef": "envgen://building/garage/single",
      "cover": "full",
      "constraints": {
        "maxFloors": 1,
        "roofs": [
          "flat",
          "mono_pitch"
        ],
        "conditions": [
          "intact",
          "damaged"
        ]
      }
    },
    {
      "id": "building.house.flat_modern",
      "category": "building",
      "kinds": [
        "house",
        "office"
      ],
      "tags": [
        "stylized",
        "modern",
        "concrete"
      ],
      "dimensions": {
        "widthM": 10,
        "depthM": 9,
        "heightM": 6.5
      },
      "variants": 2,
      "assetRef": "envgen://building/house/flat_modern",
      "weight": 0.5,
      "cover": "full",
      "constraints": {
        "minFloors": 1,
        "maxFloors": 3,
        "roofs": [
          "flat"
        ],
        "conditions": [
          "intact",
          "damaged"
        ]
      }
    },
    {
      "id": "building.house.medium_hip",
      "category": "building",
      "kinds": [
        "house"
      ],
      "tags": [
        "stylized",
        "rural",
        "plaster"
      ],
      "dimensions": {
        "widthM": 11,
        "depthM": 8,
        "heightM": 8.0
      },
      "variants": 3,
      "assetRef": "envgen://building/house/medium_hip",
      "cover": "full",
      "constraints": {
        "minFloors": 1,
        "maxFloors": 2,
        "roofs": [
          "hip"
        ],
        "conditions": [
          "intact",
          "damaged"
        ]
      }
    },
    {
      "id": "building.house.small_gable",
      "category": "building",
      "kinds": [
        "house"
      ],
      "tags": [
        "stylized",
        "rural",
        "brick"
      ],
      "dimensions": {
        "widthM": 9,
        "depthM": 7,
        "heightM": 7.5
      },
      "variants": 4,
      "assetRef": "envgen://building/house/small_gable",
      "weight": 2,